<?xml version="1.0" encoding="UTF-8"?>

<migliori_ristoranti xmlns:xs="http://www.w3.org/2001/XMLSchema-instance" xs:noNamespaceSchemaLocation="./asporto.xsd">
  <ristorante>
    <nome>Ristorante da Mario</nome>
    <localita>Roma</localita>
    <indirizzo>
      <via>Via delle Rose</via>
      <numCivico>123</numCivico>
      <CAP>00100</CAP>
      <telefono>
        <prefisso>+39</prefisso>
        <numero>1234567890</numero>
      </telefono>
      <link>http://www.ristorantedamario.com</link>
    </indirizzo>
    <antipasti>
      <piatto>
        <nome>Bruschetta</nome>
        <prezzo>6.50</prezzo>
      </piatto>
    </antipasti>
    <primi>
      <piatto>
        <nome>Pasta Carbonara</nome>
        <prezzo>9.75</prezzo>
      </piatto>
    </primi>
    <secondi>
      <piatto>
        <nome>Filetto di Manzo</nome>
        <prezzo>20.00</prezzo>
      </piatto>
    </secondi>
    <contorni>
      <piatto>
        <nome>Insalata Mista</nome>
        <prezzo>4.00</prezzo>
      </piatto>
    </contorni>
    <dessert>
      <piatto>
        <nome>Tiramis√π</nome>
        <prezzo>7.50</prezzo>
      </piatto>
    </dessert>
  </ristorante>
  
  <ristorante>
    <nome>Ristorante Buona Tavola</nome>
    <localita>Milano</localita>
    <indirizzo>
      <via>Via dei Sapori</via>
      <numCivico>42</numCivico>
      <CAP>20100</CAP>
      <telefono>
        <prefisso>+39</prefisso>
        <numero>9876543210</numero>
      </telefono>
    </indirizzo>
    <antipasti>
      <piatto>
        <nome>Crescentine</nome>
        <prezzo>5.50</prezzo>
        </piatto>
        <piatto>
        <nome>Insulti</nome>
        <prezzo>5.50</prezzo>
      </piatto>
    </antipasti>
    <primi>
      <piatto>
        <nome>Risotto ai Funghi</nome>
        <prezzo>11.25</prezzo>
      </piatto>
    </primi>
    <secondi>
      <piatto>
        <nome>Bistecca alla Griglia</nome>
        <prezzo>18.00</prezzo>
      </piatto>
    </secondi>
    <contorni>
      <piatto>
        <nome>Patatine Fritte</nome>
        <prezzo>3.50</prezzo>
      </piatto>
    </contorni>
    <dessert>
      <piatto>
        <nome>Panna Cotta</nome>
        <prezzo>6.75</prezzo>
      </piatto>
    </dessert>
  </ristorante>
  
  <!-- Altri ristoranti... -->
</migliori_ristoranti>
